{
  "id": "articulation_attacks_releases_002",
  "description": "Isolated onset, tonguing, repetition, accent, release, and threshold tests.",
  "sampleRate": 48000,
  "tests": [
    {
      "id": "hard_tongue_E4",
      "description": "Fast breath step followed by a settling plateau; approximates a hard tongue without a dedicated tongue parameter.",
      "durationSeconds": 2.2,
      "events": [
        {
          "time": 0.0,
          "type": "noteOn",
          "note": 64
        },
        {
          "time": 0.0,
          "type": "control",
          "target": "breath",
          "value": 0.02
        },
        {
          "time": 0.025,
          "type": "control",
          "target": "breath",
          "value": 0.92,
          "curve": "linear"
        },
        {
          "time": 0.16,
          "type": "control",
          "target": "breath",
          "value": 0.62,
          "curve": "linear"
        },
        {
          "time": 2.0,
          "type": "noteOff",
          "note": 64
        }
      ]
    },
    {
      "id": "soft_tongue_E4",
      "description": "Short but gentle onset ramp, distinct from the existing very slow soft-onset test.",
      "durationSeconds": 2.2,
      "events": [
        {
          "time": 0.0,
          "type": "noteOn",
          "note": 64
        },
        {
          "time": 0.0,
          "type": "control",
          "target": "breath",
          "value": 0.04
        },
        {
          "time": 0.18,
          "type": "control",
          "target": "breath",
          "value": 0.56,
          "curve": "linear"
        },
        {
          "time": 2.0,
          "type": "noteOff",
          "note": 64
        }
      ]
    },
    {
      "id": "marcato_G4",
      "description": "Strong accented onset, rapid decay, then sustained body.",
      "durationSeconds": 2.5,
      "events": [
        {
          "time": 0.0,
          "type": "noteOn",
          "note": 67
        },
        {
          "time": 0.0,
          "type": "control",
          "target": "breath",
          "value": 0.08
        },
        {
          "time": 0.04,
          "type": "control",
          "target": "breath",
          "value": 1.0,
          "curve": "linear"
        },
        {
          "time": 0.22,
          "type": "control",
          "target": "breath",
          "value": 0.52,
          "curve": "linear"
        },
        {
          "time": 2.3,
          "type": "noteOff",
          "note": 67
        }
      ]
    },
    {
      "id": "tenuto_F4",
      "description": "Firm onset, nearly flat sustain, and late release.",
      "durationSeconds": 2.5,
      "events": [
        {
          "time": 0.0,
          "type": "noteOn",
          "note": 65
        },
        {
          "time": 0.0,
          "type": "control",
          "target": "breath",
          "value": 0.1
        },
        {
          "time": 0.1,
          "type": "control",
          "target": "breath",
          "value": 0.64,
          "curve": "linear"
        },
        {
          "time": 2.42,
          "type": "noteOff",
          "note": 65
        }
      ]
    },
    {
      "id": "staccato_quarters_C4",
      "description": "Four separated short notes testing deterministic restart and release tails.",
      "durationSeconds": 2.5,
      "events": [
        {
          "time": 0.0,
          "type": "control",
          "target": "breath",
          "value": 0.68
        },
        {
          "time": 0.1,
          "type": "noteOn",
          "note": 60
        },
        {
          "time": 0.32,
          "type": "noteOff",
          "note": 60
        },
        {
          "time": 0.65,
          "type": "noteOn",
          "note": 60
        },
        {
          "time": 0.87,
          "type": "noteOff",
          "note": 60
        },
        {
          "time": 1.2,
          "type": "noteOn",
          "note": 60
        },
        {
          "time": 1.42,
          "type": "noteOff",
          "note": 60
        },
        {
          "time": 1.75,
          "type": "noteOn",
          "note": 60
        },
        {
          "time": 1.97,
          "type": "noteOff",
          "note": 60
        }
      ]
    },
    {
      "id": "breath_rearticulation_D4",
      "description": "One held note gate with four breath pulses; tests whether pressure-only rearticulation is viable.",
      "durationSeconds": 2.8,
      "events": [
        {
          "time": 0.0,
          "type": "noteOn",
          "note": 62
        },
        {
          "time": 0.0,
          "type": "control",
          "target": "breath",
          "value": 0.0
        },
        {
          "time": 0.12,
          "type": "control",
          "target": "breath",
          "value": 0.68
        },
        {
          "time": 0.46,
          "type": "control",
          "target": "breath",
          "value": 0.08
        },
        {
          "time": 0.7,
          "type": "control",
          "target": "breath",
          "value": 0.68
        },
        {
          "time": 1.04,
          "type": "control",
          "target": "breath",
          "value": 0.08
        },
        {
          "time": 1.28,
          "type": "control",
          "target": "breath",
          "value": 0.68
        },
        {
          "time": 1.62,
          "type": "control",
          "target": "breath",
          "value": 0.08
        },
        {
          "time": 1.86,
          "type": "control",
          "target": "breath",
          "value": 0.68
        },
        {
          "time": 2.2,
          "type": "control",
          "target": "breath",
          "value": 0.08
        },
        {
          "time": 2.55,
          "type": "noteOff",
          "note": 62
        }
      ]
    },
    {
      "id": "subtone_threshold_Bb3",
      "description": "Very slow pressure crossing around the expected speaking threshold.",
      "durationSeconds": 4.0,
      "events": [
        {
          "time": 0.0,
          "type": "noteOn",
          "note": 58
        },
        {
          "time": 0.0,
          "type": "control",
          "target": "breath",
          "value": 0.02
        },
        {
          "time": 2.4,
          "type": "control",
          "target": "breath",
          "value": 0.34,
          "curve": "linear"
        },
        {
          "time": 3.4,
          "type": "control",
          "target": "breath",
          "value": 0.22,
          "curve": "linear"
        },
        {
          "time": 3.8,
          "type": "noteOff",
          "note": 58
        }
      ]
    },
    {
      "id": "breath_cut_release_A3",
      "description": "Release by breath cutoff before noteOff, exposing residual bore ringing.",
      "durationSeconds": 3.0,
      "events": [
        {
          "time": 0.0,
          "type": "noteOn",
          "note": 57
        },
        {
          "time": 0.0,
          "type": "control",
          "target": "breath",
          "value": 0.62
        },
        {
          "time": 2.0,
          "type": "control",
          "target": "breath",
          "value": 0.0
        },
        {
          "time": 2.7,
          "type": "noteOff",
          "note": 57
        }
      ]
    }
  ]
}
